1	although those are also scheduled
1	those are also scheduled really
1	are also scheduled really fast,
1	also scheduled really fast, so
1	scheduled really fast, so i-
1	really fast, so i- you
1	fast, so i- you know
1	so i- you know if--
1	i- you know if-- if-
1	you know if-- if- if
1	know if-- if- if you
1	if-- if- if you don't
1	if- if you don't see
1	if you don't see it
1	you don't see it i--
1	don't see it i-- i-
1	see it i-- i- there-
1	it i-- i- there- there-
1	i-- i- there- there- i'll-
1	i- there- there- i'll- there's
1	there- there- i'll- there's a
1	there- i'll- there's a way
1	i'll- there's a way i
1	there's a way i can
1	a way i can figure
1	way i can figure that
1	i can figure that out.
1	can figure that out. wells:
1	figure that out. wells: okay.
1	that out. wells: okay. i
1	out. wells: okay. i manhas:
1	wells: okay. i manhas: i'm
1	okay. i manhas: i'm sure.
1	i manhas: i'm sure. wells:
1	manhas: i'm sure. wells: and
1	i'm sure. wells: and if
1	sure. wells: and if we
1	wells: and if we have
1	and if we have questions
1	if we have questions like
1	we have questions like that
1	have questions like that i'll
1	questions like that i'll run
1	like that i'll run 'em
1	that i'll run 'em manhas:
1	i'll run 'em manhas: okay,
1	run 'em manhas: okay, okay.
1	'em manhas: okay, okay. wells:
1	manhas: okay, okay. wells: guys
1	okay, okay. wells: guys and
1	okay. wells: guys and we
1	wells: guys and we can
1	guys and we can figure
1	and we can figure that
1	we can figure that out.
1	can figure that out. manhas:
1	figure that out. manhas: okay.
1	that out. manhas: okay. .
1	out. manhas: okay. . a
1	manhas: okay. . a wells:
1	okay. . a wells: okay,
1	. a wells: okay, second
1	a wells: okay, second trip
1	wells: okay, second trip to
1	okay, second trip to salem
1	second trip to salem within
1	trip to salem within that
1	to salem within that same
1	salem within that same period
1	within that same period of
1	that same period of time?
1	same period of time? salem
1	period of time? salem legislative
1	of time? salem legislative session'?
1	time? salem legislative session'? manhas:
1	salem legislative session'? manhas: yeah,
1	legislative session'? manhas: yeah, yeah,
1	session'? manhas: yeah, yeah, wells:
1	manhas: yeah, yeah, wells: okay.
1	yeah, yeah, wells: okay. i
1	yeah, wells: okay. i manhas:
1	wells: okay. i manhas: know
1	okay. i manhas: know the
1	i manhas: know the house
1	manhas: know the house and
1	know the house and then
1	the house and then the
1	house and then the senate
1	and then the senate and
1	then the senate and yeah,
1	the senate and yeah, we
1	senate and yeah, we went
1	and yeah, we went together
1	yeah, we went together and
1	we went together and we
1	went together and we came
1	together and we came back,
1	and we came back, i
1	we came back, i mean
1	came back, i mean that
1	back, i mean that wasn't.
1	i mean that wasn't. .
1	mean that wasn't. . ..
1	that wasn't. . .. wells:
1	wasn't. . .. wells: okay.
1	. .. wells: okay. .
1	.. wells: okay. . .
1	wells: okay. . . .yeah.
1	okay. . . .yeah. this
1	. . .yeah. this document
1	. .yeah. this document is
1	.yeah. this document is the
1	july 31, 2013 page l4
1	31, 2013 page l4 of
1	2013 page l4 of 60
1	page l4 of 60 wells:
1	l4 of 60 wells: .
1	of 60 wells: . any
1	60 wells: . any stays
1	wells: . any stays on
1	. any stays on that
1	any stays on that trip?
1	stays on that trip? manhas:
1	on that trip? manhas: um,
1	that trip? manhas: um, any
1	trip? manhas: um, any hotel
1	manhas: um, any hotel stays?
1	um, any hotel stays? wells:
1	any hotel stays? wells: yes.
1	hotel stays? wells: yes. manhas:
1	stays? wells: yes. manhas: no.
1	wells: yes. manhas: no. wells:
1	yes. manhas: no. wells: okay,
1	manhas: no. wells: okay, maybe
1	no. wells: okay, maybe i'll
1	wells: okay, maybe i'll ask
1	okay, maybe i'll ask that
1	maybe i'll ask that differently.'any
1	i'll ask that differently.'any sex
1	ask that differently.'any sex on
1	that differently.'any sex on that
1	differently.'any sex on that trip?
1	sex on that trip? manhas:
1	on that trip? manhas: (laughswent-
1	that trip? manhas: (laughswent- we
1	trip? manhas: (laughswent- we went
1	manhas: (laughswent- we went to
1	(laughswent- we went to his
1	we went to his mom's
1	went to his mom's place.
1	to his mom's place. wells:
1	his mom's place. wells: to
1	mom's place. wells: to his
1	place. wells: to his mom's?
1	wells: to his mom's? manhas:
1	to his mom's? manhas: wells:
1	his mom's? manhas: wells: okay,
1	mom's? manhas: wells: okay, and
1	manhas: wells: okay, and is
1	wells: okay, and is that
1	okay, and is that in
1	and is that in salem?
1	is that in salem? manhas:
1	that in salem? manhas: no
1	in salem? manhas: no it's
1	salem? manhas: no it's in
1	manhas: no it's in portland.
1	no it's in portland. wells:
1	it's in portland. wells: portland?
1	in portland. wells: portland? okay.
1	portland. wells: portland? okay. again,
1	wells: portland? okay. again, your
1	portland? okay. again, your car?
1	okay. again, your car? his
1	again, your car? his car?
1	your car? his car? manhas:
1	car? his car? manhas: his
1	his car? manhas: his car.
1	manhas: his car. wells: personal
1	his car. wells: personal car?
1	car. wells: personal car? his
1	wells: personal car? his personal
1	personal car? his personal vehicle?
1	car? his personal vehicle? manhas:
1	his personal vehicle? manhas: yeah,
1	personal vehicle? manhas: yeah, yeah,
1	vehicle? manhas: yeah, yeah, sorry
1	manhas: yeah, yeah, sorry i'm
1	yeah, yeah, sorry i'm just
1	yeah, sorry i'm just trying
1	sorry i'm just trying to
1	i'm just trying to make
1	just trying to make sure
1	trying to make sure i'm
1	to make sure i'm getting
1	make sure i'm getting this
1	sure i'm getting this right.
1	i'm getting this right. wells:
1	getting this right. wells: no,
1	this right. wells: no, that's
1	right. wells: no, that's fine.
1	wells: no, that's fine. manhas:
1	no, that's fine. manhas: am
1	that's fine. manhas: am i
1	fine. manhas: am i getting
1	manhas: am i getting this
1	am i getting this right?
1	i getting this right? (pause)
1	getting this right? (pause) i
1	this right? (pause) i think
1	right? (pause) i think so,
1	(pause) i think so, yeah.
1	i think so, yeah. kmetic:
1	think so, yeah. kmetic: there
1	so, yeah. kmetic: there inevitably
1	yeah. kmetic: there inevitably might
1	kmetic: there inevitably might be
1	there inevitably might be things
1	inevitably might be things as
1	might be things as you-
1	be things as you- like
1	things as you- like after
1	as you- like after we're
1	you- like after we're done,
1	like after we're done, i
1	after we're done, i mean?
1	we're done, i mean? you
1	done, i mean? you go
1	i mean? you go home
1	mean? you go home and
1	you go home and you
1	go home and you say
1	home and you say you
1	and you say you know
1	you say you know what
1	say you know what i
1	you know what i like
1	know what i like switched
1	what i like switched the-
1	i like switched the- you
1	like switched the- you can
1	switched the- you can just
1	the- you can just tell
1	you can just tell her
1	can just tell her and
1	just tell her and you
1	tell her and you if
1	her and you if you
1	and you if you want
1	you if you want to
1	if you want to communicate
1	you want to communicate that
1	want to communicate that to
1	to communicate that to us,
1	communicate that to us, i
1	that to us, i mean
1	to us, i mean it's
1	us, i mean it's not
1	i mean it's not like
1	mean it's not like you
1	it's not like you can't-
1	not like you can't- that
1	like you can't- that this
1	you can't- that this is
1	can't- that this is set
1	that this is set in
1	this is set in stone
1	is set in stone and
1	set in stone and then
1	in stone and then you
1	stone and then you start
1	and then you start thinking
1	then you start thinking about
1	you start thinking about it
1	start thinking about it and
1	thinking about it and you
1	about it and you know,
1	it and you know, i
1	and you know, i mean,
1	you know, i mean, there
1	know, i mean, there may
1	i mean, there may or
1	mean, there may or not
1	there may or not may
1	may or not may be
1	or not may be things
1	not may be things like
1	may be things like that
1	be things like that so
1	things like that so feel
1	like that so feel free
1	that so feel free to
1	so feel free to communicate
1	feel free to communicate those.
1	free to communicate those. -
1	to communicate those. - wells:
1	communicate those. - wells: she's
1	those. - wells: she's doin'
1	- wells: she's doin' a
1	wells: she's doin' a really
1	she's doin' a really good
1	doin' a really good job
1	a really good job of
1	really good job of keeping
1	good job of keeping notes.
1	job of keeping notes. manhas:
1	of keeping notes. manhas: you
1	keeping notes. manhas: you can't
1	notes. manhas: you can't mean
1	manhas: you can't mean it.
1	you can't mean it. this
1	can't mean it. this document
1	mean it. this document is
1	2013 page 15 of 60
1	page 15 of 60 wells:
1	15 of 60 wells: (laughs)
1	of 60 wells: (laughs) way
1	60 wells: (laughs) way better
1	wells: (laughs) way better than
1	(laughs) way better than i
1	way better than i can,
1	better than i can, so
1	than i can, so yeah,
1	i can, so yeah, i
1	can, so yeah, i mean
1	so yeah, i mean feel
1	yeah, i mean feel free
1	i mean feel free and-
1	mean feel free and- and
1	feel free and- and do
1	free and- and do that
1	and- and do that if
1	and do that if something
1	do that if something comes
1	that if something comes up
1	if something comes up that-
1	something comes up that- okay,
1	comes up that- okay, any
1	up that- okay, any other
1	that- okay, any other uh
1	okay, any other uh trips
1	any other uh trips that
1	other uh trips that you
1	uh trips that you can
1	trips that you can 'think
1	that you can 'think of,
1	you can 'think of, that
1	can 'think of, that you
1	'think of, that you guys
1	of, that you guys have
1	that you guys have taken
1	you guys have taken together?
1	guys have taken together? manhas:
1	have taken together? manhas: that--
1	taken together? manhas: that-- you--
1	together? manhas: that-- you-- i
1	manhas: that-- you-- i mean
1	that-- you-- i mean we're
1	you-- i mean we're talking
1	i mean we're talking all
1	mean we're talking all within
1	we're talking all within the
1	talking all within the scope
1	all within the scope of-
1	within the scope of- of-
1	the scope of- of- like
1	scope of- of- like work
1	of- of- like work days
1	of- like work days or
1	like work days or i'm.
1	work days or i'm. ..
1	days or i'm. .. .
1	or i'm. .. . wells:
1	i'm. .. . wells: both,
1	.. . wells: both, either
1	. wells: both, either or,
1	wells: both, either or, both
1	both, either or, both work
1	either or, both work or
1	or, both work or personal
1	both work or personal trips.
1	work or personal trips. manhas:
1	or personal trips. manhas: mrnm,
1	personal trips. manhas: mrnm, okay.
1	trips. manhas: mrnm, okay. um,
1	manhas: mrnm, okay. um, we
1	mrnm, okay. um, we did
1	okay. um, we did go
1	um, we did go to
1	we did go to the
1	did go to the be--
1	go to the be-- we-
1	to the be-- we- we-
1	the be-- we- we- um
1	be-- we- we- um had
1	we- we- um had one
1	we- um had one night
1	um had one night at
1	had one night at the
1	one night at the beach.
1	night at the beach. wells:
1	at the beach. wells: okay,
1	the beach. wells: okay, recent_?
1	beach. wells: okay, recent_? long
1	wells: okay, recent_? long ago?
1	okay, recent_? long ago? manhas:
1	recent_? long ago? manhas: um,
1	long ago? manhas: um, was
1	ago? manhas: um, was it
1	manhas: um, was it before?
1	um, was it before? it
1	was it before? it was
1	it before? it was in
1	before? it was in february?
1	it was in february? no.
1	was in february? no. it
1	in february? no. it was
1	february? no. it was before
1	no. it was before the
1	it was before the april
1	was before the april trip
1	before the april trip to
1	the april trip to atlanta.
1	april trip to atlanta. it
1	trip to atlanta. it was
1	to atlanta. it was the
1	atlanta. it was the end
1	it was the end of
1	was the end of february.
1	the end of february. kmetic:
1	end of february. kmetic: was
1	of february. kmetic: was during
1	february. kmetic: was during the
1	kmetic: was during the work
1	was during the work week
1	during the work week or
1	the work week or on
1	work week or on the
1	week or on the weekend?
1	or on the weekend? manhas:
1	on the weekend? manhas: weekend.
1	the weekend? manhas: weekend. kmetic:
1	weekend? manhas: weekend. kmetic: (inaudible)
1	manhas: weekend. kmetic: (inaudible) wells:
1	weekend. kmetic: (inaudible) wells: any
1	kmetic: (inaudible) wells: any other
1	(inaudible) wells: any other work
1	wells: any other work week
1	any other work week trips
1	other work week trips anywhere,
1	work week trips anywhere, business
1	week trips anywhere, business trips,
1	trips anywhere, business trips, combination
1	anywhere, business trips, combination trips?
1	business trips, combination trips? manhas:
1	trips, combination trips? manhas: no.
1	combination trips? manhas: no. .
1	trips? manhas: no. . wells:
1	manhas: no. . wells: okay.
1	no. . wells: okay. alright.
1	. wells: okay. alright. do
1	wells: okay. alright. do you
1	okay. alright. do you have
1	alright. do you have anything
1	do you have anything else
1	you have anything else with
1	have anything else with travel?
1	anything else with travel? kmetic:
1	else with travel? kmetic: no.
1	with travel? kmetic: no. wells:
1	travel? kmetic: no. wells: okay.
1	kmetic: no. wells: okay. let's
1	no. wells: okay. let's move
1	wells: okay. let's move on
1	okay. let's move on and
1	let's move on and talk
1	move on and talk about
1	on and talk about um
1	and talk about um budgets,
1	talk about um budgets, so.
1	about um budgets, so. ..
1	um budgets, so. .. manhas:
1	budgets, so. .. manhas: yeah.
1	so. .. manhas: yeah. iwells:
1	.. manhas: yeah. iwells: .
1	manhas: yeah. iwells: . .
1	yeah. iwells: . . .1
1	iwells: . . .1 don't
1	. . .1 don't know
1	. .1 don't know if
1	.1 don't know if you
1	don't know if you read
1	know if you read today's
1	if you read today's paper?
1	you read today's paper? manhas:
1	read today's paper? manhas: i
1	today's paper? manhas: i sure
1	paper? manhas: i sure did.
1	manhas: i sure did. wells:
1	i sure did. wells: alright.
1	sure did. wells: alright. .
1	did. wells: alright. . .
1	wells: alright. . . manhas:
1	alright. . . manhas: wells:
1	. . manhas: wells: talk
1	. manhas: wells: talk about
1	manhas: wells: talk about that.
1	wells: talk about that. manhas:
1	talk about that. manhas: yeah,
1	about that. manhas: yeah, yeah.
1	that. manhas: yeah, yeah. this
1	manhas: yeah, yeah. this document
1	yeah, yeah. this document is
1	oregon department of justice. cjd00o7--13
1	department of justice. cjd00o7--13 manhas
1	of justice. cjd00o7--13 manhas sonia
1	justice. cjd00o7--13 manhas sonia transcript
1	sonia transcript of interview .
1	transcript of interview . july
1	of interview . july 31,
1	interview . july 31, 2013
1	. july 31, 2013 page
1	july 31, 2013 page 16
1	31, 2013 page 16 of
1	2013 page 16 of 60
1	page 16 of 60 mckanna:
1	16 of 60 mckanna: wells
1	of 60 mckanna: wells manhas
1	60 mckanna: wells manhas wells
1	mckanna: wells manhas wells manhas
1	soul have it right? manhas:
1	wells manhas wells manhas: mckanna:
1	manhas wells manhas: mckanna: wells
1	wells manhas: mckanna: wells kmetic:
1	manhas: mckanna: wells kmetic: wells
1	mckanna: wells kmetic: wells manhas
1	wells kmetic: wells manhas wells
1	wells manhas wells manhas the
1	manhas wells manhas the oregonian
1	wells manhas the oregonian and
1	manhas the oregonian and the
1	the oregonian and the williamette
1	oregonian and the williamette week
1	and the williamette week (laughs).
1	the williamette week (laughs). what,
1	williamette week (laughs). what, well
1	week (laughs). what, well they're
1	(laughs). what, well they're both
1	what, well they're both in
1	well they're both in (laughs)
1	they're both in (laughs) i
1	both in (laughs) i read
1	in (laughs) i read like
1	(laughs) i read like this
1	i read like this much
1	read like this much and
1	like this much and i'm
1	this much and i'm like
1	much and i'm like ..
1	and i'm like .. yeah,
1	i'm like .. yeah, no
1	like .. yeah, no i'm.
1	.. yeah, no i'm. ..
1	yeah, no i'm. .. thing
1	no i'm. .. thing to
1	i'm. .. thing to talk
1	.. thing to talk about.
1	thing to talk about. happy
1	to talk about. happy to
1	talk about. happy to speak
1	about. happy to speak to
1	happy to speak to this.
1	to speak to this. (unintelligible
1	speak to this. (unintelligible --
1	to this. (unintelligible -- laughing)
1	this. (unintelligible -- laughing) okayread
1	(unintelligible -- laughing) okayread the
1	-- laughing) okayread the willamette
1	laughing) okayread the willamette week.
1	okayread the willamette week. so
1	the willamette week. so you
1	willamette week. so you know
1	week. so you know what
1	so you know what the
1	you know what the quest-
1	know what the quest- i
1	what the quest- i mean-
1	the quest- i mean- we
1	quest- i mean- we just
1	i mean- we just wanna-
1	mean- we just wanna- what-
1	we just wanna- what- you
1	just wanna- what- you know
1	wanna- what- you know what
1	what- you know what the
1	you know what the questions
1	know what the questions are
1	what the questions are about
1	the questions are about this.
1	questions are about this. so
1	are about this. so obviously
1	about this. so obviously the
1	this. so obviously the accusation
1	so obviously the accusation there
1	obviously the accusation there is
1	the accusation there is that
1	accusation there is that you
1	there is that you made
1	is that you made an--
1	that you made an-- an
1	you made an-- an end-around
1	made an-- an end-around and
1	an-- an end-around and you
1	an end-around and you got
1	end-around and you got this
1	and you got this budget
1	you got this budget passed.
1	got this budget passed. .
1	this budget passed. . no.
1	budget passed. . no. so
1	passed. . no. so let's-
1	. no. so let's- let's
1	no. so let's- let's talk
1	so let's- let's talk about
1	let's- let's talk about that.
1	let's talk about that. no,
1	talk about that. no, l-
1	about that. no, l- i
1	that. no, l- i re-
1	no, l- i re- the
1	l- i re- the magic
1	i re- the magic power
1	re- the magic power people
1	the magic power people think
1	magic power people think i
1	power people think i have
1	people think i have is
1	think i have is unbelievable.
1	i have is unbelievable. no
1	have is unbelievable. no not
1	is unbelievable. no not at
1	unbelievable. no not at all,
1	no not at all, not
1	not at all, not at
1	at all, not at all.
1	all, not at all. the
1	not at all. the budget
1	at all. the budget process
1	all. the budget process is
1	the budget process is led
1	budget process is led by
1	process is led by lillian
1	is led by lillian shirley
1	led by lillian shirley and
1	by lillian shirley and wendy
1	lillian shirley and wendy lear,
1	shirley and wendy lear, that
1	and wendy lear, that she's
1	wendy lear, that she's the
1	lear, that she's the budget
1	that she's the budget manager
1	she's the budget manager and
1	the budget manager and you
1	budget manager and you know
1	manager and you know the-
1	and you know the- the-
1	you know the- the- the-
1	know the- the- the- the
1	the- the- the- the truth
1	the- the- the truth is-
1	the- the truth is- tu-
1	the truth is- tu- there's
1	truth is- tu- there's a
1	is- tu- there's a long
1	tu- there's a long term
1	there's a long term truth
1	a long term truth of
1	long term truth of the
1	term truth of the fact
1	truth of the fact that
1	of the fact that we-
1	the fact that we- i
1	fact that we- i mean
1	that we- i mean 1-
1	we- i mean 1- i-
1	i mean 1- i- can't
1	mean 1- i- can't say
1	1- i- can't say we
1	i- can't say we haven't
1	can't say we haven't been
1	say we haven't been trying
1	we haven't been trying to
1	haven't been trying to build
1	been trying to build a
1	trying to build a case
1	to build a case for
1	build a case for prevention
1	a case for prevention and
1	case for prevention and a
1	for prevention and a the
1	prevention and a the work
1	and a the work for
1	a the work for many
1	the work for many years,
1	work for many years, right?
1	for many years, right? of
1	many years, right? of course,
1	years, right? of course, we've
1	right? of course, we've been
1	of course, we've been trying
1	course, we've been trying to
1	we've been trying to build,
1	been trying to build, but
1	trying to build, but this
1	to build, but this is
1	build, but this is like
1	but this is like good
1	this is like good work
1	is like good work and
1	like good work and it
1	good work and it is
1	work and it is good
1	and it is good work
1	it is good work and
1	is good work and um
1	good work and um the
1	work and um the grant
1	and um the grant has
1	um the grant has been
1	the grant has been ramping
1	grant has been ramping down,
1	has been ramping down, right?
1	been ramping down, right? and
1	ramping down, right? and so
1	down, right? and so we--
1	right? and so we-- obviously
1	and so we-- obviously we
1	so we-- obviously we were
1	we-- obviously we were like
1	obviously we were like okay
1	we were like okay how
1	were like okay how were
1	like okay how were we
1	okay how were we going
1	how were we going to
1	were we going to sustain
1	we going to sustain capacity?
1	going to sustain capacity? but
1	to sustain capacity? but it-
1	sustain capacity? but it- i'd
1	capacity? but it- i'd had
1	but it- i'd had nothing
1	it- i'd had nothing to
1	i'd had nothing to do
1	me soul have it right?
1	nothing to do with the
1	to do with the budget
1	do with the budget planning.
1	with the budget planning. lillian
1	the budget planning. lillian told
1	budget planning. lillian told me
1	planning. lillian told me in
1	lillian told me in one
1	told me in one of
1	me in one of the
1	in one of the supervision
1	one of the supervision meetings
1	of the supervision meetings that
1	the supervision meetings that i
1	supervision meetings that i had
1	meetings that i had with
1	that i had with her,
1	i had with her, like
1	had with her, like one
1	with her, like one of
1	her, like one of our
1	like one of our check-ins
1	one of our check-ins that
1	of our check-ins that the
1	our check-ins that the county
1	check-ins that the county was
1	that the county was going
1	the county was going be-
1	county was going be- put
1	was going be- put forward
1	going be- put forward two
1	be- put forward two out-
1	put forward two out- out
1	forward two out- out of
1	two out- out of budget
1	out- out of budget constraint
1	out of budget constraint proposals
1	of budget constraint proposals and
1	budget constraint proposals and one
1	constraint proposals and one would
1	proposals and one would be
1	and one would be related
1	one would be related to
1	would be related to the
1	be related to the office
1	related to the office of--
1	to the office of-- of
1	the office of-- of policy
1	office of-- of policy and
1	of-- of policy and planning.
1	of policy and planning. i
1	policy and planning. i was
1	and planning. i was thrilled
1	planning. i was thrilled um
1	i was thrilled um but
1	was thrilled um but no
1	thrilled um but no i
1	um but no i mean
1	but no i mean not
1	no i mean not the-
1	i mean not the- the-
1	mean not the- the- the-
1	not the- the- the- the
1	the- the- the- the stuff
1	the- the- the stuff about
1	the- the stuff about the
1	the stuff about the finances
1	stuff about the finances 1-
1	about the finances 1- i-
1	the finances 1- i- again,
1	finances 1- i- again, i
1	1- i- again, i know
1	i- again, i know there's
1	again, i know there's a
1	i know there's a scale
1	know there's a scale but
1	there's a scale but there's
1	a scale but there's just
1	scale but there's just no
1	but there's just no way
1	there's just no way that
1	just no way that i
1	no way that i would-
1	way that i would- i
1	that i would- i would
1	i would- i would do
1	would- i would do that
1	i would do that kind
1	would do that kind of
1	do that kind of an--
1	that kind of an-- an
1	kind of an-- an ask
1	of an-- an ask and
1	an-- an ask and i
1	an ask and i really
1	ask and i really respect
1	and i really respect lillian.
1	i really respect lillian. she's
1	really respect lillian. she's had-
1	respect lillian. she's had- she's
1	lillian. she's had- she's been
1	she's had- she's been a
1	had- she's been a mentor
1	she's been a mentor for--
1	been a mentor for-- for
1	a mentor for-- for me
1	mentor for-- for me for
1	for-- for me for years
1	for me for years and
1	me for years and that's
1	for years and that's been
1	years and that's been what-
1	and that's been what- part
1	that's been what- part of
1	been what- part of the
1	what- part of the painful
1	part of the painful thing
1	of the painful thing here.
1	the painful thing here. i
1	painful thing here. i am
1	thing here. i am not
1	here. i am not trying
1	i am not trying to
1	am not trying to undermi-
1	not trying to undermi- what-
1	trying to undermi- what- what
1	to undermi- what- what would
1	undermi- what- what would i
1	what- what would i gain
1	what would i gain by
1	would i gain by undermining
1	i gain by undermining lillian?
1	gain by undermining lillian? nothing,
1	by undermining lillian? nothing, that
1	undermining lillian? nothing, that this
1	lillian? nothing, that this document
1	nothing, that this document is
1	for me soul have it
1	name for me soul have
1	whole name for me soul
1	your whole name for me
1	spell your whole name for
1	you spell your whole name
1	july 31, 2013 page 17
1	31, 2013 page 17 of
1	2013 page 17 of 60
1	page 17 of 60 doesn't
1	17 of 60 doesn't make
1	of 60 doesn't make sense.
1	60 doesn't make sense. so
1	doesn't make sense. so they
1	make sense. so they directed
1	sense. so they directed me
1	so they directed me to
1	they directed me to put
1	directed me to put together
1	me to put together what
1	to put together what would
1	put together what would the
1	together what would the budget-
