1	mckenna: nervous 'cause they feel
1	nervous 'cause they feel like
1	'cause they feel like they
1	they feel like they have
1	feel like they have to
1	like they have to respond
1	they have to respond at
1	have to respond at eleven
1	to respond at eleven or
1	respond at eleven or twelve
1	at eleven or twelve at
1	eleven or twelve at night.
1	or twelve at night. .
1	twelve at night. . wells:
1	at night. . wells: i
1	night. . wells: i totally
1	. wells: i totally understand.
1	wells: i totally understand. so.
1	i totally understand. so. ..
1	totally understand. so. .. manhas:
1	understand. so. .. manhas: yeah.
1	so. .. manhas: yeah. wells:
1	.. manhas: yeah. wells: so
1	manhas: yeah. wells: so just
1	yeah. wells: so just so
1	wells: so just so were
1	so just so were clear,
1	just so were clear, i
1	so were clear, i mean
1	were clear, i mean manhas:
1	clear, i mean manhas: okay,
1	i mean manhas: okay, alright,
1	mean manhas: okay, alright, thanks.
1	manhas: okay, alright, thanks. wells:
1	okay, alright, thanks. wells: that
1	alright, thanks. wells: that makes
1	thanks. wells: that makes a
1	wells: that makes a little
1	that makes a little bit
1	makes a little bit more
1	a little bit more sense.
1	little bit more sense. manhas:
1	bit more sense. manhas: thanks,
1	more sense. manhas: thanks, that's
1	sense. manhas: thanks, that's right.
1	manhas: thanks, that's right. mckenna:
1	thanks, that's right. mckenna: she
1	that's right. mckenna: she does
1	right. mckenna: she does have
1	mckenna: she does have some
1	she does have some personal
1	does have some personal time,
1	have some personal time, that's
1	some personal time, that's what
1	personal time, that's what you
1	time, that's what you said.
1	that's what you said. this
1	what you said. this document
1	you said. this document is
1	said. this document is the
1	always have a county cell
1	you always have a county
1	2013 page 27 of 46
1	page 27 of 46 wells
1	27 of 46 wells mckenna:
1	of 46 wells mckenna: wells:
1	46 wells mckenna: wells: a
1	wells mckenna: wells: a mckenna:
1	mckenna: wells: a mckenna: manhas
1	wells: a mckenna: manhas wells:
1	a mckenna: manhas wells: manhas
1	mckenna: manhas wells: manhas wells
1	manhas 2 wells manhas kmetic:
1	2 wells manhas kmetic: manhas
1	wells manhas kmetic: manhas and-
1	manhas kmetic: manhas and- and
1	kmetic: manhas and- and it
1	manhas and- and it may
1	and- and it may vary
1	and it may vary whether
1	it may vary whether it's
1	may vary whether it's between
1	vary whether it's between 8
1	whether it's between 8 and
1	it's between 8 and 5
1	between 8 and 5 or
1	8 and 5 or midnight
1	and 5 or midnight or
1	5 or midnight or whatever.
1	or midnight or whatever. ..
1	midnight or whatever. .. right.
1	or whatever. .. right. she-
1	whatever. .. right. she- but-
1	.. right. she- but- f1ne-
1	right. she- but- f1ne- okay.
1	she- but- f1ne- okay. alright.
1	but- f1ne- okay. alright. so
1	f1ne- okay. alright. so we
1	okay. alright. so we we
1	alright. so we we we're
1	so we we we're at
1	we we we're at luncheons,
1	we we're at luncheons, you
1	we're at luncheons, you guys
1	at luncheons, you guys kiss
1	luncheons, you guys kiss and
1	you guys kiss and we're
1	guys kiss and we're moving
1	kiss and we're moving on
1	and we're moving on from
1	we're moving on from there.
1	moving on from there. right.
1	on from there. right. .,
1	from there. right. ., uh
1	there. right. ., uh (laughs).
1	right. ., uh (laughs). it
1	., uh (laughs). it was
1	uh (laughs). it was mutual.
1	(laughs). it was mutual. it
1	it was mutual. it was
1	was mutual. it was mutual.
1	mutual. it was mutual. so
1	it was mutual. so i
1	was mutual. so i mean
1	mutual. so i mean what--
1	so i mean what-- how
1	i mean what-- how did
1	mean what-- how did how
1	what-- how did how did
1	how did how did this
1	did how did this come
1	how did this come to
1	did this come to be?
1	this come to be? how
1	come to be? how did
1	to be? how did this
1	be? how did this progress
1	how did this progress from
1	did this progress from there?
1	this progress from there? okay,
1	progress from there? okay, um,
1	from there? okay, um, i
1	there? okay, um, i mean
1	okay, um, i mean it's
1	um, i mean it's not
1	i mean it's not quite
1	mean it's not quite as
1	it's not quite as salacious
1	not quite as salacious as
1	quite as salacious as everybody
1	as salacious as everybody would
1	salacious as everybody would want
1	as everybody would want to
1	everybody would want to think.
1	would want to think. it's-
1	want to think. it's- it's
1	to think. it's- it's you
1	think. it's- it's you know
1	it's- it's you know it's--
1	it's you know it's-- it's
1	you know it's-- it's lunches
1	know it's-- it's lunches for
1	it's-- it's lunches for somebody
1	it's lunches for somebody that
1	lunches for somebody that takes
1	for somebody that takes no
1	somebody that takes no lunches,
1	that takes no lunches, it
1	takes no lunches, it was
1	no lunches, it was like
1	lunches, it was like lunches,
1	it was like lunches, um,
1	was like lunches, um, and
1	like lunches, um, and lunches
1	lunches, um, and lunches in
1	um, and lunches in public
1	and lunches in public places
1	lunches in public places of
1	in public places of having
1	public places of having food
1	places of having food (laughs),
1	of having food (laughs), spending
1	having food (laughs), spending time
1	food (laughs), spending time together,
1	(laughs), spending time together, you
1	spending time together, you know
1	time together, you know it
1	together, you know it was
1	you know it was how
1	know it was how often?
1	it was how often? um,
1	was how often? um, i'd
1	how often? um, i'd say
1	often? um, i'd say weekly,
1	um, i'd say weekly, absolutely,
1	i'd say weekly, absolutely, yeah,
1	say weekly, absolutely, yeah, i
1	weekly, absolutely, yeah, i mean,
1	absolutely, yeah, i mean, a
1	yeah, i mean, a couple
1	i mean, a couple times
1	mean, a couple times a
1	a couple times a week,
1	couple times a week, um
1	times a week, um of
1	a week, um of trying
1	week, um of trying to
1	um of trying to fit
1	of trying to fit in
1	trying to fit in lunch,
1	to fit in lunch, maybe
1	fit in lunch, maybe coffee
1	in lunch, maybe coffee you
1	lunch, maybe coffee you know
1	maybe coffee you know um,
1	coffee you know um, we
1	you know um, we um,
1	know um, we um, we
1	um, we um, we started
1	we um, we started walking
1	um, we started walking on
1	we started walking on the
1	started walking on the weekends
1	walking on the weekends you
1	on the weekends you know
1	the weekends you know we
1	weekends you know we actually
1	you know we actually are
1	know we actually are in
1	we actually are in the
1	actually are in the same
1	are in the same neighborhood
1	in the same neighborhood and
1	the same neighborhood and we'd
1	same neighborhood and we'd spend
1	neighborhood and we'd spend a
1	and we'd spend a couple
1	we'd spend a couple hours
1	spend a couple hours walking.
1	a couple hours walking. i
1	couple hours walking. i mean
1	hours walking. i mean this
1	walking. i mean this is
1	i mean this is all
1	mean this is all out-
1	this is all out- like
1	is all out- like this
1	all out- like this is
1	out- like this is all
1	like this is all out
1	this is all out as
1	is all out as friends
1	all out as friends would
1	out as friends would be
1	as friends would be of--
1	friends would be of-- of-
1	would be of-- of- of
1	be of-- of- of walking
1	of-- of- of walking all
1	of- of walking all over
1	of walking all over north-,
1	walking all over north-, northeast
1	all over north-, northeast portland
1	over north-, northeast portland and
1	north-, northeast portland and talking
1	northeast portland and talking and
1	portland and talking and it
1	and talking and it was
1	talking and it was you
1	and it was you know
1	it was you know from
1	was you know from my
1	you know from my perspective
1	know from my perspective you
1	from my perspective you know
1	my perspective you know what--
1	perspective you know what-- however
1	you know what-- however it's
1	know what-- however it's presented
1	what-- however it's presented in
1	however it's presented in the
1	it's presented in the media
1	presented in the media now
1	in the media now or-
1	the media now or- or
1	media now or- or jeff
1	now or- or jeff speaks
1	or- or jeff speaks to
1	or jeff speaks to it-
1	jeff speaks to it- for--
1	speaks to it- for-- for
1	to it- for-- for me,
1	it- for-- for me, it
1	for-- for me, it was
1	for me, it was you
1	me, it was you know
1	it was you know deep
1	was you know deep intellectual
1	you know deep intellectual emotional
1	know deep intellectual emotional intimacy,
1	deep intellectual emotional intimacy, i
1	intellectual emotional intimacy, i mean
1	emotional intimacy, i mean that's
1	intimacy, i mean that's what
1	i mean that's what it
1	mean that's what it became.
1	that's what it became. i'd
1	what it became. i'd gone
1	it became. i'd gone through
1	became. i'd gone through lots
1	i'd gone through lots of
1	gone through lots of trauma
1	through lots of trauma you
1	lots of trauma you know
1	of trauma you know kind
1	trauma you know kind of
1	you know kind of just
1	know kind of just even
1	kind of just even trying
1	of just even trying to
1	just even trying to get
1	even trying to get through
1	trying to get through the
1	to get through the grant
1	get through the grant of
1	through the grant of working
1	the grant of working so
1	grant of working so hard
1	of working so hard and
1	working so hard and so
1	so hard and so fast
1	hard and so fast and
1	and so fast and it
1	so fast and it was
1	fast and it was a
1	and it was a moment
1	it was a moment of
1	was a moment of reflec-
1	a moment of reflec- like
1	moment of reflec- like i
1	of reflec- like i thinking
1	reflec- like i thinking and
1	like i thinking and talking
1	i thinking and talking and
1	thinking and talking and music
1	and talking and music and
1	talking and music and books
1	and music and books and
1	music and books and so
1	and books and so it
1	books and so it was-
1	and so it was- it
1	so it was- it was
1	it was- it was walks
1	was- it was walks on
1	it was walks on the
1	was walks on the weekend
1	walks on the weekend and
1	on the weekend and lunches,
1	the weekend and lunches, um,
1	weekend and lunches, um, you
1	and lunches, um, you know
1	lunches, um, you know the--
1	um, you know the-- the--
1	you know the-- the-- the
1	know the-- the-- the sex
1	the-- the-- the sex piece
1	the-- the sex piece was
1	the sex piece was more
1	sex piece was more sporadic
1	piece was more sporadic then
1	was more sporadic then anyone
1	more sporadic then anyone would-
1	sporadic then anyone would- would
1	then anyone would- would think
1	anyone would- would think to
1	would- would think to be
1	would think to be honest
1	think to be honest with
1	did you always have a
1	be honest with you, um,
1	honest with you, um, but
1	with you, um, but it
1	you, um, but it happen-
1	um, but it happen- it
1	but it happen- it did
1	it happen- it did happen,
1	happen- it did happen, this
1	it did happen, this document
1	did happen, this document is
1	happen, this document is the
1	interview transcript july 3 1,
1	transcript july 3 1, 2013
1	july 3 1, 2013 page
1	3 1, 2013 page 28
1	1, 2013 page 28 of
1	2013 page 28 of 46
1	page 28 of 46 wells:
1	28 of 46 wells: okay.
1	of 46 wells: okay. now
1	46 wells: okay. now how-
1	wells: okay. now how- so
1	okay. now how- so you're
1	now how- so you're doing
1	how- so you're doing this--
1	so you're doing this-- in--
1	you're doing this-- in-- i
1	doing this-- in-- i mean
1	this-- in-- i mean in--
1	in-- i mean in-- your
1	i mean in-- your obviously
1	mean in-- your obviously in
1	in-- your obviously in your
1	your obviously in your relationship
1	obviously in your relationship your
1	in your relationship your kind
1	your relationship your kind of
1	relationship your kind of an
1	your kind of an open
1	kind of an open relationship
1	of an open relationship at
1	an open relationship at this
1	open relationship at this point,
1	relationship at this point, jeff
1	at this point, jeff at
1	this point, jeff at this
1	point, jeff at this point
1	jeff at this point is
1	at this point is married
1	this point is married to
1	point is married to my
1	is married to my knowledge,
1	married to my knowledge, are
1	to my knowledge, are you
1	my knowledge, are you guys
1	knowledge, are you guys trying
1	are you guys trying to
1	you guys trying to hide
1	guys trying to hide this
1	trying to hide this at
1	to hide this at all?
1	hide this at all? or
1	this at all? or are
1	at all? or are they
1	all? or are they goin'
1	or are they goin' through
1	are they goin' through problems
1	they goin' through problems where
1	goin' through problems where he's
1	through problems where he's okay
1	problems where he's okay with
1	where he's okay with bein'
1	he's okay with bein' out
1	okay with bein' out in
1	with bein' out in the
1	bein' out in the public
1	out in the public like
1	in the public like manhas:
1	the public like manhas: yeah.
1	public like manhas: yeah. wells:
1	like manhas: yeah. wells: seems
1	manhas: yeah. wells: seems strangelfrom
1	yeah. wells: seems strangelfrom my
1	wells: seems strangelfrom my manhas:
1	seems strangelfrom my manhas: i--
1	strangelfrom my manhas: i-- i
1	my manhas: i-- i hear
1	manhas: i-- i hear you
1	i-- i hear you it's
1	i hear you it's complic.
1	hear you it's complic. ..
1	you it's complic. .. wells:
1	it's complic. .. wells: you
1	complic. .. wells: you know
1	.. wells: you know he's
1	wells: you know he's out
1	you know he's out on
1	know he's out on two
1	he's out on two hour
1	out on two hour walks
1	on two hour walks on
1	two hour walks on the
1	hour walks on the weekend
1	walks on the weekend while
1	on the weekend while he's
1	the weekend while he's married
1	weekend while he's married and
1	while he's married and his
1	he's married and his wife-
1	married and his wife- i'm
1	and his wife- i'm manhas:
1	his wife- i'm manhas: she
1	wife- i'm manhas: she knows.
1	i'm manhas: she knows. at
1	manhas: she knows. at home
1	she knows. at home with
1	knows. at home with the
1	at home with the kids.
1	home with the kids. manhas:
1	with the kids. manhas: she
1	the kids. manhas: she knew
1	kids. manhas: she knew we
1	manhas: she knew we were
1	she knew we were walking.
1	knew we were walking. wells:
1	we were walking. wells: okay.
1	were walking. wells: okay. i
1	walking. wells: okay. i manhas:
1	wells: okay. i manhas: yeah.
1	okay. i manhas: yeah. kmetic:
1	i manhas: yeah. kmetic: well
1	manhas: yeah. kmetic: well she-
1	yeah. kmetic: well she- she
1	kmetic: well she- she thought
1	well she- she thought you
1	she- she thought you were,
1	she thought you were, 'cause
1	thought you were, 'cause she
1	you were, 'cause she had
1	were, 'cause she had to
1	'cause she had to assume
1	she had to assume you
1	had to assume you were
1	to assume you were friends.
1	assume you were friends. i
1	you were friends. i mean
1	were friends. i mean she's
1	friends. i mean she's just
1	i mean she's just not
1	mean she's just not letting
1	she's just not letting her
1	just not letting her husband
1	not letting her husband go
1	letting her husband go or-
1	her husband go or- manhas:
1	husband go or- manhas: oh,
1	go or- manhas: oh, absolutely.
1	or- manhas: oh, absolutely. kmetic:
1	manhas: oh, absolutely. kmetic: there
1	oh, absolutely. kmetic: there problems?
1	absolutely. kmetic: there problems? oh,
1	kmetic: there problems? oh, okay.
1	there problems? oh, okay. manhas:
1	problems? oh, okay. manhas: no,
1	oh, okay. manhas: no, absolutely,
1	okay. manhas: no, absolutely, she
1	manhas: no, absolutely, she knew
1	no, absolutely, she knew we
1	absolutely, she knew we were
1	she knew we were friends.
1	knew we were friends. i
1	we were friends. i mean
1	were friends. i mean this
1	friends. i mean this is
1	i mean this is complicated
1	mean this is complicated that
1	this is complicated that we
1	is complicated that we were
1	complicated that we were friends
1	that we were friends and
1	we were friends and you
1	were friends and you know
1	friends and you know that
1	and you know that beginning
1	you know that beginning of
1	know that beginning of time
1	that beginning of time was
1	beginning of time was trying
1	of time was trying to
1	time was trying to understand,
1	was trying to understand, again,
1	trying to understand, again, i
1	to understand, again, i mean
1	understand, again, i mean every--
1	again, i mean every-- it's
1	i mean every-- it's not
1	mean every-- it's not this
1	every-- it's not this taw-
1	it's not this taw- tawdry
1	not this taw- tawdry thing,
1	this taw- tawdry thing, we
1	taw- tawdry thing, we were
1	tawdry thing, we were actually
1	thing, we were actually trying
1	we were actually trying to
1	were actually trying to contemplate
1	actually trying to contemplate how
1	trying to contemplate how to
1	to contemplate how to create
1	contemplate how to create space
1	how to create space of
1	to create space of like
1	create space of like friendship
1	space of like friendship or
1	of like friendship or what
1	like friendship or what is-
1	friendship or what is- like
1	or what is- like what
1	what is- like what is
1	is- like what is this
1	like what is this and
1	what is this and how
1	is this and how do
1	this and how do we
1	and how do we do
1	how do we do this
1	do we do this in
1	we do this in a
1	do this in a way
1	this in a way that
1	in a way that not
1	a way that not you
1	way that not you know
1	that not you know damaging,
1	not you know damaging, to
1	you know damaging, to yourselves
1	know damaging, to yourselves or
1	damaging, to yourselves or to
1	to yourselves or to your
1	yourselves or to your respective
1	or to your respective partner-
1	to your respective partner- manhas:
1	your respective partner- manhas: everybody,
1	respective partner- manhas: everybody, i
1	partner- manhas: everybody, i mean
1	manhas: everybody, i mean kmetic:
1	everybody, i mean kmetic: i
1	i mean kmetic: i assume
1	mean kmetic: i assume the
1	kmetic: i assume the families,
1	i assume the families, the
1	assume the families, the families.
1	the families, the families. this
1	families, the families. this document
1	the families. this document is
1	families. this document is the
1	kmetic: did you always have
1	9-5-3-9 kmetic: did you always
1	2013 page 29 of 46
1	page 29 of 46 manhas
1	29 of 46 manhas wells
1	2-5-3 9-5-3-9 kmetic: did you
1	46 manhas wells manhas kmetic:
1	9-7-1 2-5-3 9-5-3-9 kmetic: did
1	um, 9-7-1 2-5-3 9-5-3-9 kmetic:
1	manhas kmetic: manhas kmetic: i
1	kmetic: manhas kmetic: i mean
1	manhas kmetic: i mean i
1	kmetic: i mean i felt
1	i mean i felt solid
1	mean i felt solid with-
1	i felt solid with- i
1	felt solid with- i mean
1	solid with- i mean like
1	with- i mean like i
1	manhas: um, 9-7-1 2-5-3 9-5-3-9
1	mean like i said you're
1	like i said you're gonna
1	i said you're gonna see
1	said you're gonna see it
1	you're gonna see it the
1	gonna see it the way
1	see it the way you
1	it the way you see
1	the way you see it,
1	way you see it, ohn's
1	you see it, ohn's living
1	see it, ohn's living in
1	it, ohn's living in the
1	ohn's living in the house,
1	living in the house, you
1	in the house, you know
1	the house, you know i
1	house, you know i feel
1	you know i feel like
1	know i feel like i
1	i feel like i had
1	feel like i had a
1	like i had a conversat-
1	i had a conversat- that
1	had a conversat- that we
1	a conversat- that we talked
1	conversat- that we talked about
1	that we talked about it
1	we talked about it and
1	talked about it and he
1	about it and he knew
1	it and he knew that
1	and he knew that i
1	number? manhas: um, 9-7-1 2-5-3
1	knew that i was you
1	that i was you know
1	i was you know gonna
1	was you know gonna see--
1	you know gonna see-- see
1	know gonna see-- see other
1	gonna see-- see other people
1	see-- see other people or
1	see other people or whatever
1	other people or whatever and
1	people or whatever and so
1	or whatever and so i
1	whatever and so i feel--
1	and so i feel-- like
1	so i feel-- like i
1	i feel-- like i wasn't
1	feel-- like i wasn't cheating
1	like i wasn't cheating on
1	i wasn't cheating on my
1	wasn't cheating on my husband
1	cheating on my husband at
1	on my husband at that
1	my husband at that point.
1	husband at that point. um,
1	at that point. um, he
1	that point. um, he was
1	point. um, he was cheating
1	um, he was cheating on
1	he was cheating on lisa
1	was cheating on lisa and
1	cheating on lisa and i--
1	on lisa and i-- i
1	lisa and i-- i knew
1	and i-- i knew that
1	i-- i knew that and
1	i knew that and it
1	knew that and it was
1	that and it was not
1	and it was not good,
1	it was not good, obviously,
1	was not good, obviously, um,
1	not good, obviously, um, it
1	good, obviously, um, it wasn't
1	obviously, um, it wasn't meant
1	um, it wasn't meant to
1	it wasn't meant to be
1	wasn't meant to be that
1	meant to be that way,
1	to be that way, it
1	be that way, it was
1	that way, it was never
1	way, it was never meant
1	it was never meant to
1	was never meant to be
1	never meant to be that
1	meant to be that way
1	to be that way i
1	be that way i mean
1	that way i mean it
1	way i mean it was
1	i mean it was not
1	mean it was not meant
1	it was not meant to
1	phone number? manhas: um, 9-7-1
1	not meant to be hidden,
1	meant to be hidden, um,
1	to be hidden, um, the
1	be hidden, um, the friendship
1	hidden, um, the friendship was
1	um, the friendship was not
1	the friendship was not meant
1	friendship was not meant to
1	not meant to be hidden
1	meant to be hidden that's
1	to be hidden that's why
1	be hidden that's why were
1	hidden that's why were out,
1	that's why were out, we're
1	why were out, we're like
1	were out, we're like this
1	out, we're like this is
1	we're like this is okay,
1	like this is okay, we
1	this is okay, we can
1	is okay, we can be
1	okay, we can be out,
1	we can be out, we
1	can be out, we can
1	be out, we can go
1	out, we can go for
1	we can go for a
1	can go for a walk
1	go for a walk um,
1	for a walk um, it's
1	a walk um, it's just,
1	walk um, it's just, we
1	um, it's just, we went
1	it's just, we went out
1	just, we went out for
1	we went out for lunch
1	went out for lunch i
1	out for lunch i mean,
1	for lunch i mean, people
1	lunch i mean, people saw
1	i mean, people saw us,
1	mean, people saw us, we
1	people saw us, we weren't
1	saw us, we weren't trying
1	us, we weren't trying to
1	we weren't trying to hide
1	weren't trying to hide that.
1	trying to hide that. and
1	to hide that. and when
1	hide that. and when people
1	that. and when people say
1	and when people say they
1	when people say they saw
1	people say they saw us
1	say they saw us all
1	they saw us all over
1	saw us all over town,
1	us all over town, it's
1	all over town, it's true,
1	over town, it's true, they
1	town, it's true, they did.
1	it's true, they did. okay.
1	true, they did. okay. i
1	they did. okay. i (laughs)
1	did. okay. i (laughs) we
1	okay. i (laughs) we were-
1	i (laughs) we were- we
1	(laughs) we were- we were
1	we were- we were hanging
1	were- we were hanging out
1	we were hanging out um,
1	were hanging out um, um.
1	hanging out um, um. when
1	out um, um. when you
1	um, um. when you went
1	um. when you went to
1	when you went to lunch
1	you went to lunch um,
1	went to lunch um, i
1	to lunch um, i mean
1	lunch um, i mean obviously
1	um, i mean obviously you're
1	i mean obviously you're out
1	mean obviously you're out in
1	obviously you're out in public,
1	you're out in public, you're
1	out in public, you're not
1	in public, you're not hiding
1	public, you're not hiding it
1	you're not hiding it whatever,
1	not hiding it whatever, i
1	hiding it whatever, i mean
1	it whatever, i mean how--
1	whatever, i mean how-- would
1	i mean how-- would you
1	mean how-- would you pay
1	how-- would you pay for
1	would you pay for lunch,
1	you pay for lunch, would
1	pay for lunch, would he
1	for lunch, would he pay
1	lunch, would he pay for
1	would he pay for lunch,
1	he pay for lunch, is
1	pay for lunch, is there
1	for lunch, is there uh-
1	lunch, is there uh- like
1	is there uh- like a
1	there uh- like a government
1	uh- like a government card
1	like a government card that
1	a government card that could
1	government card that could be
1	card that could be used?
1	that could be used? no,
1	could be used? no, god
1	be used? no, god no,
1	used? no, god no, there
1	no, god no, there was
1	god no, there was never-
1	no, there was never- this
1	there was never- this is-
1	was never- this is- from
1	never- this is- from my
1	this is- from my perspective
1	is- from my perspective from
1	from my perspective from my
1	my perspective from my time
1	perspective from my time this
1	from my time this was
1	my time this was never
1	time this was never a
1	this was never a work
1	was never a work lunch
1	never a work lunch and
1	a work lunch and this
1	work lunch and this was
1	lunch and this was never
1	and this was never paid
1	this was never paid for-
1	was never paid for- with
1	never paid for- with county
1	paid for- with county funds,
1	for- with county funds, i
1	with county funds, i mean,
1	county funds, i mean, that
1	funds, i mean, that is-
1	i mean, that is- that
1	mean, that is- that is-
1	that is- that is- that's
1	is- that is- that's really
1	that is- that's really true,
1	is- that's really true, i
1	that's really true, i mean
1	really true, i mean i
1	true, i mean i don't
1	cell phone number? manhas: um,
1	mean i don't have a
1	i don't have a county
1	don't have a county card
1	have a county card to
1	a county card to do
1	county card to do that
1	card to do that kind
1	county cell phone number? manhas:
1	do that kind of thing.'we've
1	that kind of thing.'we've got
1	kind of thing.'we've got really
1	of thing.'we've got really strict
1	thing.'we've got really strict guidelines
1	got really strict guidelines about
1	really strict guidelines about how
