1	and i know- i'm- i'm-
1	i know- i'm- i'm- i
1	know- i'm- i'm- i know
1	i'm- i'm- i know that,
1	i'm- i know that, the
1	i know that, the whole.
1	know that, the whole. ..
1	that, the whole. .. a
1	the whole. .. a but
1	whole. .. a but like
1	.. a but like i
1	a but like i said
1	but like i said we
1	like i said we don't
1	i said we don't have
1	said we don't have the
1	we don't have the complaints
1	don't have the complaints either
1	have the complaints either so
1	the complaints either so this
1	complaints either so this the-
1	either so this the- the
1	so this the- the whole-
1	this the- the whole- the
1	the- the whole- the whole
1	the whole- the whole inquiry
1	whole- the whole inquiry was
1	the whole inquiry was so
1	whole inquiry was so twisted
1	inquiry was so twisted up
1	was so twisted up and
1	so twisted up and the--
1	twisted up and the-- the
1	up and the-- the challenge
1	and the-- the challenge with
1	the-- the challenge with that
1	the challenge with that group
1	challenge with that group has
1	with that group has been
1	that group has been so
1	group has been so long
1	has been so long standing
1	been so long standing and
1	so long standing and i
1	long standing and i was
1	standing and i was only
1	and i was only starting
1	i was only starting to
1	was only starting to understand,
1	only starting to understand, like
1	starting to understand, like get
1	to understand, like get a
1	understand, like get a feel
1	like get a feel for
1	get a feel for it,
1	a feel for it, i
1	feel for it, i mean
1	for it, i mean literally
1	it, i mean literally in
1	i mean literally in the
1	mean literally in the dlt
1	literally in the dlt meeting-
1	in the dlt meeting- department
1	the dlt meeting- department of
1	dlt meeting- department of leadership
1	meeting- department of leadership team
1	department of leadership team meeting,
1	of leadership team meeting, on
1	leadership team meeting, on the
1	team meeting, on the 15th,
1	meeting, on the 15th, you
1	on the 15th, you know
1	the 15th, you know lillian
1	15th, you know lillian and
1	you know lillian and kathleen
1	know lillian and kathleen both
1	lillian and kathleen both said
1	and kathleen both said to
1	kathleen both said to me
1	both said to me at
1	said to me at that
1	to me at that meeting
1	me at that meeting you
1	at that meeting you know,
1	that meeting you know, your-
1	meeting you know, your- your
1	you know, your- your inheriting
1	know, your- your inheriting like
1	your- your inheriting like a
1	your inheriting like a decade
1	inheriting like a decade of
1	like a decade of some
1	a decade of some really
1	decade of some really you
1	of some really you know
1	some really you know dysfunctional
1	really you know dysfunctional dynamic
1	you know dysfunctional dynamic within
1	know dysfunctional dynamic within that
1	dysfunctional dynamic within that team
1	dynamic within that team and--
1	within that team and-- and
1	that team and-- and something
1	team and-- and something to
1	and-- and something to the
1	and something to the extent
1	something to the extent of
1	to the extent of it's
1	the extent of it's not-
1	extent of it's not- it's-
1	of it's not- it's- it's
1	it's not- it's- it's no
1	not- it's- it's no surprise
1	it's- it's no surprise that
1	it's no surprise that it's
1	no surprise that it's coming
1	surprise that it's coming out
1	that it's coming out now
1	it's coming out now with
1	coming out now with you
1	out now with you and
1	now with you and i
1	with you and i don't
1	you and i don't know
1	i don't know if they
1	don't know if they were
1	know if they were trying
1	if they were trying to
1	they were trying to insinuate
1	were trying to insinuate around
1	trying to insinuate around race
1	to insinuate around race or
1	insinuate around race or what-
1	around race or what- what
1	race or what- what that
1	or what- what that meant
1	what- what that meant but
1	what that meant but i
1	that meant but i don't
1	meant but i don't even
1	but i don't even begin
1	i don't even begin to
1	don't even begin to understand
1	even begin to understand where
1	begin to understand where mya
1	to understand where mya was
1	understand where mya was going
1	where mya was going because
1	mya was going because the--
1	was going because the-- the
1	going because the-- the parts
1	because the-- the parts on
1	the-- the parts on her-
1	the parts on her- her
1	parts on her- her inquiry
1	on her- her inquiry aro-
1	her- her inquiry aro- you
1	her inquiry aro- you know
1	inquiry aro- you know in
1	aro- you know in terms
1	you know in terms of
1	know in terms of projecting
1	in terms of projecting things
1	terms of projecting things that
1	of projecting things that she
1	projecting things that she was
1	things that she was thinking
1	that she was thinking on
1	she was thinking on other
1	was thinking on other people
1	thinking on other people you
1	on other people you know
1	other people you know it
1	people you know it was'-
1	you know it was'- it
1	know it was'- it was
1	it was'- it was really
1	was'- it was really complicated.
1	it was really complicated. some
1	was really complicated. some of
1	really complicated. some of the
1	complicated. some of the things
1	some of the things that
1	of the things that she
1	the things that she was
1	things that she was saying
1	that she was saying around
1	she was saying around claire
1	was saying around claire were
1	saying around claire were things
1	around claire were things that.she
1	claire were things that.she was
1	were things that.she was actually
1	things that.she was actually doing
1	that.she was actually doing and
1	was actually doing and so
1	actually doing and so here
1	doing and so here i
1	and so here i was
1	so here i was trying
1	here i was trying my
1	department of justice. kmetic: shannon
1	oregon department of justice. kmetic:
1	trying my best to sort
1	my best to sort out
1	best to sort out of
1	to sort out of walk
1	sort out of walk through
1	out of walk through the
1	of walk through the inquiry
1	walk through the inquiry around
1	through the inquiry around these-
1	the inquiry around these- the--
1	inquiry around these- the-- the--
1	around these- the-- the-- the--
1	these- the-- the-- the-- the
1	the-- the-- the-- the concern
1	the-- the-- the concern around
1	the-- the concern around her
1	the concern around her inquiry
1	concern around her inquiry had
1	around her inquiry had been
1	her inquiry had been were-
1	inquiry had been were- was
1	had been were- was claire
1	been were- was claire saying
1	were- was claire saying that
1	was claire saying that she
1	claire saying that she was
1	saying that she was only
1	that she was only there
1	she was only there due
1	was only there due to
1	only there due to ra-
1	there due to ra- like
1	due to ra- like because
1	to ra- like because of
1	ra- like because of race
1	like because of race and
1	because of race and making
1	of race and making allegations
1	race and making allegations around
1	and making allegations around income
1	making allegations around income so
1	allegations around income so i
1	around income so i was
1	income so i was trying
1	i was trying to hold
1	was trying to hold to-
1	trying to hold to- you
1	to hold to- you know
1	hold to- you know to,
1	to- you know to, rightdifferent
1	you know to, rightdifferent way?
1	know to, rightdifferent way? i
1	to, rightdifferent way? i just
1	rightdifferent way? i just feel
1	way? i just feel like
1	i just feel like if
1	just feel like if it
1	feel like if it came
1	like if it came up
1	if it came up either
1	it came up either way
1	came up either way 1-
1	up either way 1- i
1	either way 1- i just
1	way 1- i just don't
1	1- i just don't know
1	i just don't know what
1	just don't know what got-
1	don't know what got- what
1	know what got- what happened
1	what got- what happened here.
1	got- what happened here. weldifferent
1	what happened here. weldifferent way,
1	happened here. weldifferent way, after
1	here. weldifferent way, after you
1	weldifferent way, after you found
1	way, after you found out
1	after you found out about
1	you found out about what
1	found out about what you
1	out about what you perceived
1	about what you perceived to
1	what you perceived to be
1	you perceived to be either
1	perceived to be either mya's
1	to be either mya's uh
1	be either mya's uh opinion
1	either mya's uh opinion that
1	mya's uh opinion that you
1	uh opinion that you were
1	agent, oregon department of justice.
1	that you were having an
1	you were having an affair
1	were having an affair with
1	having an affair with cogen
1	an affair with cogen or
1	affair with cogen or claire's
1	with cogen or claire's opinion
1	cogen or claire's opinion that
1	or claire's opinion that you
1	claire's opinion that you were
1	you were having with cogen.
1	were having with cogen. ..
1	having with cogen. .. this
1	with cogen. .. this document
1	cogen. .. this document the
1	.. this document the property
1	this document the property of
1	document the property of the
1	of justice. cjdoo07-13 manhas "sonia
1	justice. cjdoo07-13 manhas "sonia transcript
1	cjdoo07-13 manhas "sonia transcript of
1	manhas "sonia transcript of interview
1	"sonia transcript of interview july
1	july 31, 2013 page 42
1	31, 2013 page 42 of
1	2013 page 42 of 60
1	page 42 of 60 kmetic:
1	42 of 60 kmetic: manhas
1	manhas kmetic: manhas kmetic: kmetic:
1	kmetic: manhas kmetic: kmetic: mckanna:
1	manhas kmetic: kmetic: mckanna: kmetic:
1	kmetic: kmetic: mckanna: kmetic: manhas
1	kmetic: mckanna: kmetic: manhas did
1	mckanna: kmetic: manhas did you
1	kmetic: manhas did you talk
1	manhas did you talk about
1	did you talk about with
1	you talk about with jeff?
1	talk about with jeff? what
1	about with jeff? what did
1	with jeff? what did you
1	jeff? what did you tell
1	what did you tell him
1	did you tell him about
1	you tell him about what
1	tell him about what you
1	him about what you knew?
1	about what you knew? well
1	what you knew? well i-
1	you knew? well i- i--
1	knew? well i- i-- i
1	well i- i-- i said
1	i- i-- i said you
1	i-- i said you know
1	i said you know this
1	said you know this isn't
1	you know this isn't good.
1	know this isn't good. i
1	this isn't good. i mean
1	isn't good. i mean if--
1	good. i mean if-- if
1	i mean if-- if people
1	mean if-- if people had
1	if-- if people had a
1	if people had a general
1	people had a general perception
1	had a general perception that
1	a general perception that this
1	general perception that this is
1	perception that this is happening,
1	that this is happening, i
1	this is happening, i was
1	is happening, i was actually
1	happening, i was actually convinced
1	i was actually convinced people
1	was actually convinced people probably
1	actually convinced people probably did-
1	convinced people probably did- you
1	people probably did- you know
1	probably did- you know i'm-
1	did- you know i'm- i
1	you know i'm- i was-
1	know i'm- i was- you
1	i'm- i was- you know
1	i was- you know i
1	was- you know i was-
1	you know i was- i've
1	know i was- i've been
1	i was- i've been worried
1	was- i've been worried about
1	i've been worried about it,
1	been worried about it, the
1	worried about it, the whole
1	about it, the whole things
1	it, the whole things been
1	the whole things been tortur-
1	whole things been tortur- you
1	things been tortur- you know
1	been tortur- you know has
1	tortur- you know has been
1	you know has been hard.
1	know has been hard. and
1	has been hard. and i,
1	been hard. and i, you
1	hard. and i, you know
1	and i, you know i-
1	i, you know i- i
1	you know i- i said
1	know i- i said to
1	i- i said to him
1	i said to him that
1	said to him that this
1	to him that this is
1	him that this is concerning,
1	that this is concerning, you
1	this is concerning, you know,
1	is concerning, you know, we
1	concerning, you know, we were-
1	you know, we were- and
1	know, we were- and this
1	we were- and this kind
1	were- and this kind of
1	and this kind of began
1	this kind of began with
1	kind of began with the
1	of began with the whole
1	began with the whole thing
1	with the whole thing of
1	the whole thing of like
1	whole thing of like what-
1	thing of like what- what
1	of like what- what are
1	like what- what are we-
1	what- what are we- you
1	what are we- you know
1	are we- you know what
1	we- you know what are
1	you know what are we
1	know what are we doing?
1	what are we doing? did
1	are we doing? did you-
1	we doing? did you- was
1	doing? did you- was there
1	did you- was there any
1	you- was there any discussion
1	was there any discussion about
1	there any discussion about changing
1	any discussion about changing behavior
1	discussion about changing behavior or
1	about changing behavior or what
1	changing behavior or what you
1	behavior or what you were
1	or what you were going
1	what you were going to
1	you were going to do
1	were going to do as
1	going to do as it
1	to do as it relates
1	do as it relates to
1	as it relates to these
1	it relates to these employees?
1	relates to these employees? or
1	to these employees? or anything
1	these employees? or anything like
1	employees? or anything like that?
1	or anything like that? no,
1	anything like that? no, i
1	like that? no, i mean
1	that? no, i mean i
1	no, i mean i just
1	i mean i just said
1	mean i just said i
1	i just said i wanted
1	just said i wanted to
1	said i wanted to walk
1	i wanted to walk the
1	wanted to walk the inquiry
1	to walk the inquiry through
1	walk the inquiry through as
1	the inquiry through as best
1	inquiry through as best i
1	through as best i could
1	as best i could in
1	best i could in supporting
1	i could in supporting this
1	could in supporting this person
1	in supporting this person who
1	supporting this person who thought
1	this person who thought she
1	person who thought she had
1	who thought she had a
1	thought she had a hostile
1	she had a hostile environment.
1	had a hostile environment. i
1	a hostile environment. i mean
1	hostile environment. i mean i--
1	environment. i mean i-- i-
1	i mean i-- i- with-
1	mean i-- i- with- with
1	i-- i- with- with truth
1	i- with- with truth the
1	with- with truth the rumors
1	with truth the rumors were
1	truth the rumors were a
1	the rumors were a piece
1	rumors were a piece of
1	were a piece of that.
1	a piece of that. i
1	piece of that. i figured
1	of that. i figured if
1	that. i figured if you
1	i figured if you know
1	figured if you know she
1	if you know she was
1	you know she was gonna
1	know she was gonna raise
1	she was gonna raise it,
1	was gonna raise it, they
1	gonna raise it, they were
1	raise it, they were gonna
1	it, they were gonna talk
1	they were gonna talk about
1	were gonna talk about this
1	gonna talk about this with
1	talk about this with the-
1	about this with the- part
1	this with the- part of
1	with the- part of the
1	the- part of the investigation,
1	part of the investigation, it
1	of the investigation, it was
1	the investigation, it was gonna
1	investigation, it was gonna happen-
1	it was gonna happen- it
1	was gonna happen- it was
1	gonna happen- it was gonna
1	happen- it was gonna happen,
1	it was gonna happen, right?
1	was gonna happen, right? i
1	gonna happen, right? i truly
1	happen, right? i truly thought
1	right? i truly thought her
1	i truly thought her intent
1	truly thought her intent was
1	thought her intent was a
1	her intent was a hostility
1	intent was a hostility that
1	was a hostility that she
1	a hostility that she was
1	hostility that she was dealing
1	that she was dealing with
1	she was dealing with with
1	was dealing with with this
1	dealing with with this person
1	with with this person around
1	with this person around concerns
1	this person around concerns around
1	person around concerns around her
1	around concerns around her race
1	concerns around her race and
1	around her race and competency
1	her race and competency and
1	race and competency and i
1	and competency and i was
1	competency and i was trying
1	and i was trying my
1	trying my best to really
1	my best to really focus
1	best to really focus on
1	to really focus on that
1	really focus on that part
1	focus on that part in
1	on that part in supporting
1	that part in supporting them.
1	part in supporting them. now
1	in supporting them. now i-
1	supporting them. now i- you
1	them. now i- you know
1	now i- you know i
1	i- you know i don't-
1	you know i don't- i
1	know i don't- i don't
1	don't- i don't know what
1	i don't know what it
1	don't know what it was
1	know what it was now,
1	what it was now, i
1	it was now, i mean
1	was now, i mean when
1	now, i mean when i
1	i mean when i put
1	mean when i put that
1	when i put that together
1	i put that together with
1	put that together with some
1	that together with some of
1	together with some of the
1	with some of the stuff
1	some of the stuff in
1	of the stuff in the
1	the stuff in the email
1	stuff in the email i
1	in the email i feel
1	the email i feel like
1	email i feel like there's
1	i feel like there's some
1	feel like there's some broader
1	like there's some broader thing
1	there's some broader thing here
1	some broader thing here around-
1	broader thing here around- around
1	thing here around- around me
1	here around- around me and
1	around- around me and percep-
1	around me and percep- you
1	me and percep- you know
1	and percep- you know anger
1	percep- you know anger with
1	you know anger with me
1	know anger with me and
1	anger with me and perception
1	with me and perception of
1	me and perception of how
1	and perception of how i
1	perception of how i hire
1	of how i hire and
1	how i hire and such.
1	i hire and such. i
1	hire and such. i don't
1	and such. i don't understand
1	such. i don't understand it.
1	i don't understand it. i
1	don't understand it. i don't--
1	understand it. i don't-- i
1	it. i don't-- i don't
1	i don't-- i don't know
1	don't-- i don't know how
1	don't know how it all
1	know how it all ties
1	how it all ties together.
1	it all ties together. so
1	all ties together. so let
1	ties together. so let me
1	together. so let me skip
1	so let me skip ahead
1	let me skip ahead maybe
1	me skip ahead maybe a
1	skip ahead maybe a little
1	ahead maybe a little bit,
1	maybe a little bit, but
1	a little bit, but i
1	little bit, but i mean
1	bit, but i mean you
1	but i mean you probably
1	i mean you probably have
1	mean you probably have to
1	you probably have to be
1	probably have to be getting
1	have to be getting tired,
1	to be getting tired, uh-
1	be getting tired, uh- the-
1	getting tired, uh- the- 1-
1	tired, uh- the- 1- i
1	uh- the- 1- i think
1	the- 1- i think she
1	1- i think she is
1	i think she is getting
1	think she is getting tired
1	she is getting tired and
1	is getting tired and i'm
1	getting tired and i'm just-
1	tired and i'm just- you
1	and i'm just- you know
1	i'm just- you know i-
1	just- you know i- i
1	you know i- i think
1	know i- i think we
1	i- i think we kind
1	i think we kind of
1	think we kind of beat
1	we kind of beat this,
1	kind of beat this, i
1	of beat this, i mean
1	beat this, i mean i
1	special agent, oregon department of
1	mean i don't know if
1	i don't know if she
1	don't know if she can
1	know if she can remember
1	if she can remember more
1	she can remember more but,
1	can remember more but, you
1	remember more but, you well
1	more but, you well this
1	but, you well this is--
1	you well this is-- but
1	well this is-- but this
1	this is-- but this is
1	is-- but this is i
1	but this is i understand.
1	this is i understand. i-
1	is i understand. i- i
1	i understand. i- i mean
1	understand. i- i mean this
1	i- i mean this is--
1	i mean this is-- i
1	mean this is-- i mean
1	this is-- i mean know
1	is-- i mean know we're
1	i mean know we're getting-
1	mean know we're getting- and
1	know we're getting- and we
1	we're getting- and we can
1	getting- and we can wrap
1	and we can wrap up
1	we can wrap up and
1	can wrap up and i
1	wrap up and i think
1	up and i think we've
1	and i think we've already
1	i think we've already said
1	think we've already said anyway
1	we've already said anyway probably
1	already said anyway probably have
1	said anyway probably have to
1	anyway probably have to come
1	probably have to come back
1	have to come back anyway
1	to come back anyway but
1	come back anyway but what-
1	back anyway but what- when
1	anyway but what- when we
1	but what- when we analyze
1	what- when we analyze everything-
1	when we analyze everything- what
1	we analyze everything- what has
1	analyze everything- what has the
1	everything- what has the communication
1	what has the communication been
1	has the communication been between
1	the communication been between you
1	communication been between you and
1	been between you and jeff
1	between you and jeff since
1	you and jeff since this
1	and jeff since this whole
1	jeff since this whole thing
1	since this whole thing broke?
1	this whole thing broke? the
1	whole thing broke? the communication
1	thing broke? the communication has
1	broke? the communication has been
1	the communication has been um
1	communication has been um shot-
1	has been um shot- i
1	been um shot- i mean
1	um shot- i mean shock,
1	shot- i mean shock, more
1	i mean shock, more of--
1	mean shock, more of-- i
1	shock, more of-- i don't
1	more of-- i don't recognize
1	of-- i don't recognize him
1	i don't recognize him (laughs)i'm-
1	don't recognize him (laughs)i'm- just
1	recognize him (laughs)i'm- just like
1	him (laughs)i'm- just like what
1	(laughs)i'm- just like what are
1	just like what are you
1	like what are you doing?
1	what are you doing? like
1	are you doing? like nothing
1	you doing? like nothing that
1	doing? like nothing that he
1	like nothing that he is
1	nothing that he is saying
1	that he is saying has
1	he is saying has been
1	is saying has been making
1	saying has been making sense
1	has been making sense to
1	been making sense to me.
1	making sense to me. .
1	sense to me. . this
1	to me. . this document
1	me. . this document is
1	. this document is the
1	of the oregon department justice
1	the oregon department justice and
1	oregon department justice and shall
1	department justice and shall not
1	31, 2013 page 43 of
1	2013 page 43 of 60
1	page 43 of 60 kmetic:
1	43 of 60 kmetic: manhas
1	kmetic: manhas kmetic manhas kmetic
1	kmetic manhas kmetic manhas kmetic:
1	manhas kmetic: manhas wells the
1	kmetic: manhas wells the publicly
1	manhas wells the publicly or
1	wells the publicly or privately?
1	the publicly or privately? or
1	publicly or privately? or both?
1	or privately? or both? publicly
1	privately? or both? publicly i--
1	or both? publicly i-- you
1	both? publicly i-- you know
1	publicly i-- you know and--
1	i-- you know and-- and
1	you know and-- and you
1	know and-- and you know
1	and-- and you know since
1	and you know since the
1	you know since the legal
1	know since the legal piece
1	since the legal piece we
1	the legal piece we haven't
1	legal piece we haven't been-
1	piece we haven't been- it's
1	we haven't been- it's like
1	haven't been- it's like we
1	been- it's like we can't
1	it's like we can't be
1	like we can't be in
1	we can't be in contact
1	can't be in contact obviously
1	be in contact obviously but
1	in contact obviously but i
1	contact obviously but i mean-
1	obviously but i mean- yeah,
1	but i mean- yeah, i
1	i mean- yeah, i just.
1	mean- yeah, i just. oh
1	yeah, i just. oh is
1	i just. oh is that-
1	just. oh is that- now
1	oh is that- now i
1	is that- now i haven't
1	that- now i haven't read
1	now i haven't read that
1	i haven't read that completely.
1	haven't read that completely. you
1	read that completely. you can't
1	that completely. you can't be
1	completely. you can't be in
1	you can't be in contact
1	can't be in contact because
1	be in contact because of
1	in contact because of the
1	contact because of the separation
1	because of the separation agreement
1	of the separation agreement or
1	the separation agreement or what?
1	separation agreement or what? oh
1	agreement or what? oh no
1	or what? oh no no,
1	what? oh no no, because
1	oh no no, because this
1	no no, because this investigation
1	no, because this investigation is
1	because this investigation is going
1	this investigation is going on
1	investigation is going on that
1	is going on that we
1	going on that we just
1	on that we just need
1	that we just need to
1	we just need to speak.
1	just need to speak. i
1	need to speak. i just
1	to speak. i just want
1	speak. i just want to
1	i just want to speak
1	just want to speak my
1	want to speak my own
1	to speak my own part
1	speak my own part of
1	my own part of it
1	own part of it so
1	part of it so we're
1	of it so we're not
1	it so we're not communicating.
1	so we're not communicating. so
1	we're not communicating. so you're
1	not communicating. so you're not
1	communicating. so you're not calling,
1	so you're not calling, texting,
1	you're not calling, texting, emailing,
1	not calling, texting, emailing, nothing?
1	calling, texting, emailing, nothing? no,
1	texting, emailing, nothing? no, no,
1	emailing, nothing? no, no, no,
1	nothing? no, no, no, no
1	no, no, no, no but-
1	no, no, no but- but-
1	no, no but- but- but
1	no but- but- but we
1	but- but- but we were--
1	but- but we were-- i
1	but we were-- i mean
1	we were-- i mean we
1	were-- i mean we were--
1	i mean we were-- we
1	mean we were-- we were
1	we were-- we were in
1	were-- we were in shock
1	we were in shock i
1	were in shock i mean
1	in shock i mean i--
1	shock i mean i-- i
1	i mean i-- i was-
1	mean i-- i was- i'm
1	i-- i was- i'm sorry
1	i was- i'm sorry i
1	was- i'm sorry i was
1	i'm sorry i was in
1	sorry i was in shock,
1	i was in shock, you
1	was in shock, you know,
1	in shock, you know, he-
1	shock, you know, he- the
1	you know, he- the way
1	know, he- the way he
1	he- the way he was
1	the way he was presenting
1	way he was presenting things
1	he was presenting things in
1	was presenting things in the
1	presenting things in the i
